{
  "$schema": "http://json-schema.org/draft-07/schema#",
  "$id": "routing.schema.json",
  "title": "Prophetis Routing Card",
  "description": "Machine contract for a Prophetis routing card. Canonical artifact: cases/<case-id>/routing.json (human-readable view: routing.md). Enforced by scripts/validate_repo.py via a stdlib subset checker supporting: type, enum, const, required, properties, minLength, minItems, allOf, if/then, and $ref to vocab.json. Enums $ref schemas/vocab.json â€?the single vocabulary source. Conditional required is orthogonal: depth-gated (quick_map<standard<deep_dive) AND route-gated (decision pressure) AND quant-gated AND follow-up-gated. NOTE: the multi-field actionability/position/portfolio trigger (route_family) is a round-2 item; round-1 enforces the decision_pressure -> disconfirmation coupling only.",
  "type": "object",
  "properties": {
    "schema_version": {"type": "string", "minLength": 1},
    "interaction_mode": {"$ref": "vocab.json#/interaction_mode"},
    "primary_intent": {"type": "string", "minLength": 1},
    "secondary_intents": {"type": "array"},
    "execution_order": {"type": "string", "minLength": 1},
    "task_mode": {"$ref": "vocab.json#/task_mode"},
    "research_object": {"type": "string", "minLength": 1},
    "market_scope": {"type": "string", "minLength": 1},
    "time_boundary": {"type": "string", "minLength": 1},
    "depth_mode": {"$ref": "vocab.json#/depth_mode"},
    "information_value": {"$ref": "vocab.json#/information_value"},
    "knowability_status": {"$ref": "vocab.json#/knowability_status"},
    "primary_question_lens": {"$ref": "vocab.json#/question_expansion_lens"},
    "selected_question_lenses": {"type": "array"},
    "lens_selection_basis": {"type": "string", "minLength": 1},
    "lens_data_required": {"type": "string", "minLength": 1},
    "lens_failure_mode": {"type": "string", "minLength": 1},
    "live_data_gate": {"$ref": "vocab.json#/live_data_gate"},
    "live_freshness_status": {"$ref": "vocab.json#/live_freshness_status"},
    "cross_check_status": {"$ref": "vocab.json#/cross_check_status"},
    "quote_time": {"type": "string", "minLength": 1},
    "publish_time": {"type": "string", "minLength": 1},
    "source_boundary": {"type": "string", "minLength": 1},
    "decision_pressure": {"$ref": "vocab.json#/decision_pressure"},
    "framing_risk": {"$ref": "vocab.json#/framing_risk"},
    "disconfirmation_required": {"$ref": "vocab.json#/disconfirmation_required"},
    "quant_dependency": {"$ref": "vocab.json#/quant_dependency"},
    "calculation_gate": {"$ref": "vocab.json#/calculation_gate"},
    "scope_confirmation_required": {"$ref": "vocab.json#/scope_confirmation_required"},
    "primary_skill_or_loop": {"type": "string", "minLength": 1},
    "routing_basis": {"type": "string", "minLength": 1},
    "routing_mismatch_risk": {"type": "string", "minLength": 1},
    "expected_output_package": {"type": "string", "minLength": 1},
    "readiness_level": {"type": "string", "minLength": 1},
    "private_state_action": {"type": "string", "minLength": 1},
    "followup_prompt_mode": {"$ref": "vocab.json#/followup_prompt_mode"},
    "critical_interaction_mode": {"$ref": "vocab.json#/critical_interaction_mode"},
    "active_followup_status": {"$ref": "vocab.json#/active_followup_status"},
    "active_followup_id": {"type": "string", "minLength": 1},
    "answer_match_confidence": {"$ref": "vocab.json#/answer_match_confidence"},
    "followup_questions": {
      "type": "array",
      "minItems": 1,
      "items": {
        "anyOf": [
          {"type": "string", "minLength": 1},
          {
            "type": "object",
            "properties": {
              "followup_id": {"type": "string", "minLength": 1},
              "question": {"type": "string", "minLength": 1},
              "rung": {"type": "string", "minLength": 1},
              "route_binding": {"type": "string", "minLength": 1},
              "object_anchor": {"type": "string", "minLength": 1},
              "decision_impact": {"type": "string", "minLength": 1},
              "next_route_if_answered": {"type": "string", "minLength": 1},
              "state_update_if_answered": {"type": "string", "minLength": 1}
            },
            "required": ["question"]
          }
        ]
      }
    },
    "followup_id": {"type": "string", "minLength": 1},
    "next_route_if_answered": {"type": "string", "minLength": 1},
    "state_update_if_answered": {"type": "string", "minLength": 1},
    "state_update_applied": {"type": "string", "minLength": 1},
    "followup_waiver_reason": {"type": "string", "minLength": 1}
  },
  "required": [
    "schema_version",
    "interaction_mode",
    "primary_intent",
    "task_mode",
    "research_object",
    "market_scope",
    "time_boundary",
    "depth_mode",
    "information_value",
    "knowability_status",
    "primary_skill_or_loop",
    "routing_basis",
    "followup_prompt_mode",
    "critical_interaction_mode",
    "active_followup_status"
  ],
  "allOf": [
    {
      "$comment": "depth: standard adds the package/readiness/private-state block",
      "if": {"properties": {"depth_mode": {"const": "standard"}}, "required": ["depth_mode"]},
      "then": {"required": ["expected_output_package", "readiness_level", "private_state_action"]}
    },
    {
      "$comment": "depth: deep_dive additionally requires the full intent + mismatch block",
      "if": {"properties": {"depth_mode": {"const": "deep_dive"}}, "required": ["depth_mode"]},
      "then": {"required": ["expected_output_package", "readiness_level", "private_state_action", "secondary_intents", "execution_order", "routing_mismatch_risk"]}
    },
    {
      "$comment": "quant: any non-none dependency requires a calculation gate",
      "if": {"properties": {"quant_dependency": {"enum": ["low", "medium", "high"]}}, "required": ["quant_dependency"]},
      "then": {"required": ["calculation_gate"]}
    },
    {
      "$comment": "question lens: any active lens requires basis, data requirements, and failure mode",
      "if": {"properties": {"primary_question_lens": {"enum": ["comparison_association", "scale_shift", "trend_dynamics", "anomaly_detection"]}}, "required": ["primary_question_lens"]},
      "then": {"required": ["lens_selection_basis", "lens_data_required", "lens_failure_mode"]}
    },
    {
      "$comment": "live data: time-sensitive market quote answers require live-source freshness and quote-time fields",
      "if": {"properties": {"live_data_gate": {"const": "required_quote_time"}}, "required": ["live_data_gate"]},
      "then": {"required": ["live_freshness_status", "cross_check_status", "quote_time", "source_boundary"]}
    },
    {
      "$comment": "live data: time-sensitive publication answers require live-source freshness and publish-time fields",
      "if": {"properties": {"live_data_gate": {"const": "required_publish_time"}}, "required": ["live_data_gate"]},
      "then": {"required": ["live_freshness_status", "cross_check_status", "publish_time", "source_boundary"]}
    },
    {
      "$comment": "route: decision_support interaction is actionability â€?must emit decision_pressure even if none (analysis-routing.md line 124 / Step 0.5)",
      "if": {"properties": {"interaction_mode": {"const": "decision_support"}}, "required": ["interaction_mode"]},
      "then": {"required": ["decision_pressure"]}
    },
    {
      "$comment": "route: position/portfolio review must emit decision_pressure even if none (analysis-routing.md line 169 / Step 0.5)",
      "if": {"properties": {"task_mode": {"enum": ["position_review", "portfolio_construction_review"]}}, "required": ["task_mode"]},
      "then": {"required": ["decision_pressure"]}
    },
    {
      "$comment": "route: medium/high decision pressure requires an explicit disconfirmation=yes",
      "if": {"properties": {"decision_pressure": {"enum": ["medium", "high"]}}, "required": ["decision_pressure"]},
      "then": {"required": ["disconfirmation_required"], "properties": {"disconfirmation_required": {"enum": ["yes"]}}}
    },
    {
      "$comment": "follow-up: light/standard/decision_grade require concrete questions (analysis-routing.md line 706)",
      "if": {"properties": {"followup_prompt_mode": {"enum": ["light", "standard", "decision_grade"]}}, "required": ["followup_prompt_mode"]},
      "then": {"required": ["followup_questions"]}
    },
    {
      "$comment": "follow-up: explicit none must carry a route-specific waiver reason",
      "if": {"properties": {"followup_prompt_mode": {"const": "none"}}, "required": ["followup_prompt_mode"]},
      "then": {"required": ["followup_waiver_reason"]}
    },
    {
      "$comment": "critical interaction: continuation requires an active follow-up id and match confidence",
      "if": {"properties": {"critical_interaction_mode": {"const": "followup_answer_continuation"}}, "required": ["critical_interaction_mode"]},
      "then": {"required": ["active_followup_id", "answer_match_confidence", "next_route_if_answered"]}
    },
    {
      "$comment": "critical interaction: waived interaction should align active follow-up status",
      "if": {"properties": {"critical_interaction_mode": {"const": "waive_with_reason"}}, "required": ["critical_interaction_mode"]},
      "then": {"required": ["followup_waiver_reason"], "properties": {"active_followup_status": {"enum": ["waived", "none"]}}}
    }
  ]
}
