{
  "schema_version": "1.0",
  "interaction_mode": "routed_research",
  "primary_intent": "NVTS FY2026 Q1 earnings analysis package with peer verification",
  "task_mode": "earnings_event",
  "research_object": "single_equity",
  "market_scope": "US equities",
  "time_boundary": "next 1-2 quarters",
  "depth_mode": "standard",
  "information_value": "high",
  "knowability_status": "knowable",
  "decision_pressure": "none",
  "framing_risk": "none",
  "disconfirmation_required": "no",
  "quant_dependency": "high",
  "calculation_gate": "required",
  "primary_skill_or_loop": "skills/earnings-report-analysis + event-delta-loop",
  "routing_basis": "Earnings-event package with peer verification and event-impact framing; serves as the canonical earnings/event golden few-shot example case.",
  "routing_mismatch_risk": "Low â€?scope is an earnings package, not a live trade call; actionability stays research-bound pending live refresh.",
  "expected_output_package": "earnings-analysis.md, financial-snapshot.csv, peer-comparison.csv, evidence-log.csv, expectation-map.csv, actionability-bridge.md",
  "readiness_level": "research_package",
  "private_state_action": "waive",
  "followup_prompt_mode": "standard",
  "followup_questions": [
    "Should AI data-center content-per-MW (customer qualification + production-ramp evidence) become the tracked core variable on the expectation map? (Rung B -> consensus proxy / evidence path)",
    "If Distributor A concentration (59% of revenue, 58% of receivables) rises again in Q2, thesis downgrade or watch item? (Rung C -> thesis_state falsification line)",
    "Before live use after Q2 2026 (stale_after 2026-08-29), refresh backlog/design-win quantification first or cash-burn moderation? (Rung A -> boundary / readiness_level)"
  ],
  "critical_interaction_mode": "progressive_followup",
  "active_followup_status": "open"
}
